{
  "schema_version": "0.1",
  "adapter_id": "read-only-review-harness-v1",
  "harness_family": "hermes",
  "adapter_type": "agent",
  "capabilities": {
    "can_read_files": true,
    "can_write_files": false,
    "can_apply_patch": false,
    "can_run_shell": false,
    "can_use_browser": false,
    "can_use_mcp": false,
    "can_read_credentials": false,
    "can_call_external_api": false,
    "authority_statement": "can_X does not imply may_X. Capabilities listed do not authorize action."
  },
  "risk_profile": {
    "risk_level": "read_only",
    "risk_reason": "No write, shell, browser, MCP, credential, or external API capability.",
    "mitigations": [
      "All actions are read-only by design.",
      "No credential access configured."
    ],
    "boundary_enforcement": "Capability fields frozen at adapter init."
  },
  "declared_boundaries": {
    "allowed_actions": [
      "read_files",
      "analyze_code",
      "suggest_review"
    ],
    "forbidden_actions": [
      "write_files",
      "run_shell",
      "call_external_api",
      "access_credentials",
      "execute_action"
    ],
    "requires_review_for": [],
    "credential_access_blocked": true,
    "external_api_blocked": true,
    "shell_blocked": true
  },
  "non_execution_statement": "This manifest describes capability only. It does not execute.",
  "authority_statement": "Capability declaration is not authorization. This manifest does not authorize any action."
}
